{
  "$schema": "http://json-schema.org/draft-07/schema#",
  "$id": "https://github.com/MrEyratnz/software-factory/schemas/factory.config.schema.json",
  "title": "Dark Software Factory — .factory/config.json",
  "description": "Per-repo factory configuration. Hooks resolve commands and paths ONLY from this validated file (a command allowlist), never by blind-evaluating arbitrary strings. The autonomous agent is fenced out of writing it (guard-scope).",
  "type": "object",
  "additionalProperties": false,
  "required": ["stack", "roadmapPath", "releaseBranch", "gates"],
  "properties": {
    "stack": { "type": "string", "enum": ["node", "python", "go", "custom"] },
    "roadmapPath": { "type": "string", "default": "docs/ROADMAP.md" },
    "adrDir": { "type": "string", "default": "docs/adr" },
    "releaseBranch": { "type": "string", "default": "main" },
    "sourceRegex": { "type": "string", "description": "regex matching source paths (for tests-first)", "default": "^src/" },
    "testRegex": { "type": "string", "description": "regex matching test paths", "default": "(\\.test\\.|\\.spec\\.|_test\\.|/tests?/|\\.feature$)" },
    "testCommandRegex": { "type": "string", "description": "regex matching the full-suite command (triggers record-green)" },
    "releaseVerbRegex": { "type": "string", "description": "regex matching release verbs (gated by guard-release)" },
    "releaseProofCommandRegex": { "type": "string", "description": "regex matching the build+smoke command on the BUILT artifact; when it exits 0 on the release branch during a release, record-release-proof mints release-proof.json" },
    "designDir": { "type": "string", "description": "root of design-system sources (fenced to design-lead)" },
    "maxIterations": { "type": "integer", "minimum": 1, "default": 10, "description": "hard cap for a /factory-run lights-out loop" },
    "testCommand": { "type": "string", "description": "explicit, unambiguous full-suite command the hooks INVOKE themselves when they must determine green deterministically (e.g. record-green with no exit-code evidence). Distinct from testCommandRegex, which only DETECTS that a suite ran. An allowlisted invoker, not a matcher." },
    "enforcement": {
      "type": "object",
      "description": "per-gate toggles for the HARD gates. Every gate defaults ON (true); set one to false to opt a single repo out of that gate deliberately and visibly, instead of the all-or-nothing plugin toggle. A session-local `.factory/state/paused` marker (human-set) relaxes every gate at once for one worktree.",
      "additionalProperties": false,
      "properties": {
        "requireGreenReceiptOnCommit": { "type": "boolean", "default": true, "description": "guard-commit: a tree-bound green receipt must exist to commit" },
        "requireTestsFirst": { "type": "boolean", "default": true, "description": "guard-commit: a feat/fix staging source must also stage a test (TDD)" },
        "conventionalCommitLint": { "type": "boolean", "default": true, "description": "guard-commit: the -m message must be a valid Conventional Commit" },
        "requireReleaseProof": { "type": "boolean", "default": true, "description": "guard-release: a release-gate proof must exist to release" },
        "enforceProjectDirScope": { "type": "boolean", "default": true, "description": "guard-scope/guard-bash-writes: writes resolving outside the project dir are denied" },
        "protectTrustRoots": { "type": "boolean", "default": true, "description": "guard-scope/guard-bash-writes: .factory/state, .factory/config.json, .factory/review are hook-managed and cannot be written directly" }
      }
    },
    "gates": {
      "type": "object",
      "description": "the per-stage 'green' commands, run in order; empty stages are skipped",
      "additionalProperties": false,
      "properties": {
        "typecheck": { "type": "string" },
        "boundaries": { "type": "string" },
        "unit": { "type": "string" },
        "bdd": { "type": "string" },
        "build": { "type": "string" },
        "drift": { "type": "string" }
      }
    },
    "generators": {
      "type": "array",
      "description": "generated-artifact sources → regenerate + diff at edit time (check-drift) and in CI",
      "items": {
        "type": "object",
        "additionalProperties": false,
        "required": ["sourceRegex", "command", "output"],
        "properties": {
          "sourceRegex": { "type": "string" },
          "command": { "type": "string" },
          "output": { "type": "string" }
        }
      },
      "default": []
    },
    "otel": {
      "type": "object",
      "description": "optional, opt-in push-based OTEL metrics. Off by default: hooks never fork or touch the network unless enabled is exactly true. The FACTORY_OTEL_ENDPOINT environment variable overrides both keys below (it is how CI opts in without writing to this hook-managed trust root).",
      "additionalProperties": false,
      "properties": {
        "enabled": { "type": "boolean", "default": false, "description": "turn on the emit calls in the hooks; no-op when false/absent" },
        "endpoint": { "type": "string", "default": "http://localhost:4318", "description": "OTLP/HTTP collector base URL; hooks POST to <endpoint>/v1/metrics" },
        "exporter": { "type": "string", "enum": ["otlphttp"], "default": "otlphttp", "description": "only OTLP/HTTP JSON is supported (zero-dep, hand-built payloads)" }
      }
    }
  }
}
